{
  "advisory_review": {
    "evidence_path": "verification_policy/ci_advisory_evidence.v1.json",
    "evidence_sha256": "61d96f89420ee65021f9e0d3d75637e96036728af7dee6fd705645d78ea57d69",
    "observed_at": "2026-09-07T05:49:01Z",
    "query_count": 31,
    "response_sha256": "0a7630ca69b5087c8f8955c50afae3e6dce2b2303a09b3fda70d9461d4fd8f70",
    "result": "none-observed-at-check",
    "source": "https://api.osv.dev/v1/querybatch"
  },
  "authority": "generated-reviewed-point-in-time",
  "checked_at": "2026-09-07T05:49:01Z",
  "clean_claim": {
    "offline_ci_claim": "hash-identity-compatibility-only",
    "offline_install_behavior": "fail-loud-no-network-fallback",
    "online_recheck_required": true,
    "valid_after_checked_at": false
  },
  "github_actions": [
    {
      "commit_sha": "3d3c42e5aac5ba805825da76410c181273ba90b1",
      "name": "actions/checkout",
      "observed_at": "2026-07-29T15:02:45Z",
      "source": "https://github.com/actions/checkout/releases/tag/v7.0.1",
      "version": "7.0.1"
    },
    {
      "commit_sha": "5fda3b95a4ea91299a34e894583c3862153e4b97",
      "name": "actions/setup-python",
      "observed_at": "2026-07-29T15:02:45Z",
      "source": "https://github.com/actions/setup-python/releases/tag/v7.0.0",
      "version": "7.0.0"
    },
    {
      "commit_sha": "a1d282b36b6f3519aa1f3fc636f609c47dddb294",
      "name": "actions/dependency-review-action",
      "observed_at": "2026-07-29T15:02:45Z",
      "source": "https://github.com/actions/dependency-review-action/releases/tag/v5.0.0",
      "version": "5.0.0"
    }
  ],
  "lock_authority": {
    "input_sha256": {
      "requirements-ci-resolver.in": "55e3173445050d9bf00a0d217abcbec83b6baa161f971d5192f28d664a2d45ef",
      "requirements-ci-resolver.lock": "842074be5fbac7fc368018d85a5b2bbb9cb3daacec5ff6e75d0da79cea89e44d",
      "requirements-ci.constraints": "567bc54c64d7664061d7e7d43a731fc2cca9cc18ef23827471d6ce6029793161",
      "requirements-dev.txt": "18f78c7b60ce9a39864491b52f5d1f51ce00478b2e3a9b3e86c670fd650486cb",
      "requirements.txt": "539450e067e10f6e7f58dd4b84dd0f5c0dd303284c6df8b780d343fdf9553a50"
    },
    "output_path": "requirements-ci.lock",
    "output_sha256": "efd4e4f85bbfa2785d85896a70e13bad124f2d9e62ba4e052dd3e82073f8ef03"
  },
  "locked_projects": [
    {
      "name": "annotated-types",
      "version": "0.8.0"
    },
    {
      "name": "attrs",
      "version": "26.1.0"
    },
    {
      "name": "cffi",
      "version": "2.1.1"
    },
    {
      "name": "colorama",
      "version": "0.4.6"
    },
    {
      "name": "cryptography",
      "version": "50.0.1"
    },
    {
      "name": "execnet",
      "version": "2.1.2"
    },
    {
      "name": "iniconfig",
      "version": "2.3.0"
    },
    {
      "name": "inquirerpy",
      "version": "0.3.4"
    },
    {
      "name": "jsonschema",
      "version": "4.26.0"
    },
    {
      "name": "jsonschema-specifications",
      "version": "2025.9.1"
    },
    {
      "name": "markdown-it-py",
      "version": "4.2.0"
    },
    {
      "name": "mdurl",
      "version": "0.1.2"
    },
    {
      "name": "packaging",
      "version": "26.2"
    },
    {
      "name": "pfzy",
      "version": "0.3.4"
    },
    {
      "name": "pluggy",
      "version": "1.6.0"
    },
    {
      "name": "prompt-toolkit",
      "version": "3.0.53"
    },
    {
      "name": "protobuf",
      "version": "7.35.1"
    },
    {
      "name": "pycparser",
      "version": "3.0"
    },
    {
      "name": "pydantic",
      "version": "2.13.4"
    },
    {
      "name": "pydantic-core",
      "version": "2.46.4"
    },
    {
      "name": "pygments",
      "version": "2.20.0"
    },
    {
      "name": "pytest",
      "version": "9.1.1"
    },
    {
      "name": "pytest-xdist",
      "version": "3.8.0"
    },
    {
      "name": "pywinpty",
      "version": "2.0.15"
    },
    {
      "name": "pyyaml",
      "version": "6.0.3"
    },
    {
      "name": "referencing",
      "version": "0.37.0"
    },
    {
      "name": "rich",
      "version": "15.0.0"
    },
    {
      "name": "rpds-py",
      "version": "2026.6.3"
    },
    {
      "name": "typing-extensions",
      "version": "4.16.0"
    },
    {
      "name": "typing-inspection",
      "version": "0.4.2"
    },
    {
      "name": "wcwidth",
      "version": "0.8.2"
    }
  ],
  "matrix": {
    "platform": [
      "linux-x86_64",
      "macos-arm64",
      "windows-x86_64"
    ],
    "python": [
      "3.11",
      "3.12"
    ]
  },
  "release_metadata": {
    "evidence_path": "verification_policy/ci_release_metadata_evidence.v1.json",
    "evidence_sha256": "9a031c1628e9ef6096d855afa8d8ada648b3226a75eafe072aafc39d086f2d50",
    "observed_at": "2026-09-07T05:49:01Z",
    "response_set_sha256": "5f3446383468b1fa8691e060ee5c8382efa1086ee6e9e670569e75243f19ccd6",
    "source": "https://pypi.org/pypi/{name}/{version}/json"
  },
  "resolver": {
    "command": [
      "python",
      "-I",
      "-m",
      "piptools",
      "compile",
      "--generate-hashes",
      "--allow-unsafe",
      "--strip-extras",
      "--resolver=backtracking",
      "--no-config",
      "--pip-args=--only-binary=:all:",
      "--output-file",
      "requirements-ci.lock",
      "requirements-dev.txt"
    ],
    "index_url": "https://pypi.org/simple",
    "name": "pip-tools",
    "python_implementation": "CPython",
    "python_version": "3.12",
    "version": "7.5.2"
  },
  "schema": "plamen.ci-dependency-provenance.v2",
  "universal_wheels": [
    {
      "filename": "annotated_types-0.8.0-py3-none-any.whl",
      "project": "annotated-types",
      "sha256": "f072f4d804ea359e4eaf198b1af7a8b0943881a87f31bb764f8bf219bb9419e0"
    },
    {
      "filename": "attrs-26.1.0-py3-none-any.whl",
      "project": "attrs",
      "sha256": "c647aa4a12dfbad9333ca4e71fe62ddc36f4e63b2d260a37a8b83d2f043ac309"
    },
    {
      "filename": "colorama-0.4.6-py2.py3-none-any.whl",
      "project": "colorama",
      "sha256": "4f1d9991f5acc0ca119f9d443620b77f9d6b33703e51011c16baf57afb285fc6"
    },
    {
      "filename": "execnet-2.1.2-py3-none-any.whl",
      "project": "execnet",
      "sha256": "67fba928dd5a544b783f6056f449e5e3931a5c378b128bc18501f7ea79e296ec"
    },
    {
      "filename": "iniconfig-2.3.0-py3-none-any.whl",
      "project": "iniconfig",
      "sha256": "f631c04d2c48c52b84d0d0549c99ff3859c98df65b3101406327ecc7d53fbf12"
    },
    {
      "filename": "InquirerPy-0.3.4-py3-none-any.whl",
      "project": "inquirerpy",
      "sha256": "c65fdfbac1fa00e3ee4fb10679f4d3ed7a012abf4833910e63c295827fe2a7d4"
    },
    {
      "filename": "jsonschema-4.26.0-py3-none-any.whl",
      "project": "jsonschema",
      "sha256": "d489f15263b8d200f8387e64b4c3a75f06629559fb73deb8fdfb525f2dab50ce"
    },
    {
      "filename": "jsonschema_specifications-2025.9.1-py3-none-any.whl",
      "project": "jsonschema-specifications",
      "sha256": "98802fee3a11ee76ecaca44429fda8a41bff98b00a0f2838151b113f210cc6fe"
    },
    {
      "filename": "markdown_it_py-4.2.0-py3-none-any.whl",
      "project": "markdown-it-py",
      "sha256": "9f7ebbcd14fe59494226453aed97c1070d83f8d24b6fc3a3bcf9a38092641c4a"
    },
    {
      "filename": "mdurl-0.1.2-py3-none-any.whl",
      "project": "mdurl",
      "sha256": "84008a41e51615a49fc9966191ff91509e3c40b939176e643fd50a5c2196b8f8"
    },
    {
      "filename": "packaging-26.2-py3-none-any.whl",
      "project": "packaging",
      "sha256": "5fc45236b9446107ff2415ce77c807cee2862cb6fac22b8a73826d0693b0980e"
    },
    {
      "filename": "pfzy-0.3.4-py3-none-any.whl",
      "project": "pfzy",
      "sha256": "5f50d5b2b3207fa72e7ec0ef08372ef652685470974a107d0d4999fc5a903a96"
    },
    {
      "filename": "pycparser-3.0-py3-none-any.whl",
      "project": "pycparser",
      "sha256": "b727414169a36b7d524c1c3e31839a521725078d7b2ff038656844266160a992"
    },
    {
      "filename": "pluggy-1.6.0-py3-none-any.whl",
      "project": "pluggy",
      "sha256": "e920276dd6813095e9377c0bc5566d94c932c33b27a3e3945d8389c374dd4746"
    },
    {
      "filename": "prompt_toolkit-3.0.53-py3-none-any.whl",
      "project": "prompt-toolkit",
      "sha256": "01c0891d7f9237d5e339f7d3e42cdae80b7534abb1c7c0e3352efba6231492f2"
    },
    {
      "filename": "pydantic-2.13.4-py3-none-any.whl",
      "project": "pydantic",
      "sha256": "45a282cde31d808236fd7ea9d919b128653c8b38b393d1c4ab335c62924d9aba"
    },
    {
      "filename": "pygments-2.20.0-py3-none-any.whl",
      "project": "pygments",
      "sha256": "81a9e26dd42fd28a23a2d169d86d7ac03b46e2f8b59ed4698fb4785f946d0176"
    },
    {
      "filename": "pytest-9.1.1-py3-none-any.whl",
      "project": "pytest",
      "sha256": "37a86b45efb9a47a61a36449063e8e18d0cab3161329fc099eb21783169c4f0c"
    },
    {
      "filename": "pytest_xdist-3.8.0-py3-none-any.whl",
      "project": "pytest-xdist",
      "sha256": "202ca578cfeb7370784a8c33d6d05bc6e13b4f25b5053c30a152269fd10f0b88"
    },
    {
      "filename": "referencing-0.37.0-py3-none-any.whl",
      "project": "referencing",
      "sha256": "381329a9f99628c9069361716891d34ad94af76e461dcb0335825aecc7692231"
    },
    {
      "filename": "rich-15.0.0-py3-none-any.whl",
      "project": "rich",
      "sha256": "33bd4ef74232fb73fe9279a257718407f169c09b78a87ad3d296f548e27de0bb"
    },
    {
      "filename": "typing_extensions-4.16.0-py3-none-any.whl",
      "project": "typing-extensions",
      "sha256": "481caa481374e813c1b176ada14e97f1f67a4539ce9cfeb3f350d78d6370c2e8"
    },
    {
      "filename": "typing_inspection-0.4.2-py3-none-any.whl",
      "project": "typing-inspection",
      "sha256": "4ed1cacbdc298c220f1bd249ed5287caa16f34d44ef4e9c3d0cbad5b521545e7"
    },
    {
      "filename": "wcwidth-0.8.2-py3-none-any.whl",
      "project": "wcwidth",
      "sha256": "d63947694a0539a1d51e01eda7caf800c291020e6cdd7e28ad7b14dd33ad4f85"
    }
  ],
  "wheel_coverage": [
    {
      "artifacts": [
        {